{
  "id": "00000000-0000-4000-8000-000000000201",
  "schema_version": "1.0.0",
  "revision": 1,
  "projectId": "00000000-0000-4000-8000-000000000001",
  "assetVersionId": "00000000-0000-4000-8000-000000000101",
  "assetVersionRevision": 0,
  "sourceHash": "aaaaaaaaaaaaaaaaaaaaaaaaaaaaaaaaaaaaaaaaaaaaaaaaaaaaaaaaaaaaaaaa",
  "sourceFingerprint": "bbbbbbbbbbbbbbbbbbbbbbbbbbbbbbbbbbbbbbbbbbbbbbbbbbbbbbbbbbbbbbbb",
  "status": "ready",
  "metadata": {
    "mimeType": "video/mp4",
    "sizeBytes": 1024,
    "checksum": "aaaaaaaaaaaaaaaaaaaaaaaaaaaaaaaaaaaaaaaaaaaaaaaaaaaaaaaaaaaaaaaa",
    "durationFrames": 60,
    "timebase": "1/30",
    "fpsNumerator": 30,
    "fpsDenominator": 1,
    "frameCount": 60,
    "width": 1080,
    "height": 1920,
    "videoCodec": "h264",
    "pixelFormat": "yuv420p",
    "audioTracks": 1,
    "sampleRate": 48000,
    "channels": 2
  },
  "tool": "ffprobe",
  "toolVersion": "7.1",
  "operationKey": "inspect:asset-version:1",
  "retention": { "policy": "phase-one", "version": "1" },
  "license": { "status": "approved" },
  "hold": false,
  "rawDiagnostic": null
}
